{
  "$schema": "http://json-schema.org/draft-07/schema#",
  "$id": "https://python-slm.local/schemas/P1A-prototype-v2/python-slm-p0a-dependency-v1.schema.json",
  "title": "python-slm selected P0A dependency for P1A v1",
  "type": "object",
  "additionalProperties": false,
  "required": [
    "schema",
    "phase_id",
    "interface_id",
    "profile_id",
    "status",
    "pointer_path",
    "pointer_sha256",
    "acceptance_path",
    "acceptance_sha256",
    "acceptance_sequence",
    "run_id",
    "run_evidence_sha256",
    "seal_sha256",
    "preapproval_commit",
    "receipt_commit",
    "approval_commit",
    "publication_commit",
    "closure_commit",
    "technical_approval_sha256",
    "data_governance_approval_sha256",
    "verified_at_source_commit"
  ],
  "properties": {
    "schema": { "const": "python-slm-p0a-dependency-v1" },
    "phase_id": { "const": "P0A" },
    "interface_id": { "const": "portable-interface-v2" },
    "profile_id": { "const": "prototype-windows-5090-v1" },
    "status": { "const": "PASS" },
    "pointer_path": { "const": "docs/receipts/P0A/evidence.json" },
    "pointer_sha256": { "const": "c3ac49fdd2aecddb677bd315678d0f0d72bba3fbd92f773289ef98871505e15d" },
    "acceptance_path": { "const": "docs/receipts/P0A/acceptances/00000001.json" },
    "acceptance_sha256": { "const": "31434001719f50de1abfa06dd84200ffb8e1f0947e08c8673f6413c08dbc4fb4" },
    "acceptance_sequence": { "const": 1 },
    "run_id": { "const": "20260813T111427138Z-594485fab70714426a7a3870" },
    "run_evidence_sha256": { "const": "c9de84843e74771fa675514f552301757b8fbadb2ea16e7afa13a0b4c40e2cd1" },
    "seal_sha256": { "const": "5248bbd6ef45e42480676a978a683a8883e68466804b0cce572af6b368044900" },
    "preapproval_commit": { "const": "f49abcca7f0b110759606c0bf9beffc911cc6635" },
    "receipt_commit": { "const": "b32651bcccf285b256acfcf5f7ca19d3dd35c947" },
    "approval_commit": { "const": "3b36781ea5cc4eb6316249d6c2fc342c61ef220e" },
    "publication_commit": { "const": "f221a638f65509ee28457a0ccc03a23bc134956b" },
    "closure_commit": { "const": "203b3580005ce59228c319d517134f910759c7bc" },
    "technical_approval_sha256": { "const": "ea9eae24d1763e8ac257a35b63f6df3648bc5ed7cb7199863d6161b3142a9765" },
    "data_governance_approval_sha256": { "const": "8273e1fb6fb8aa812253f825dd38632770fa43ed4f8246907be622bf0b0783a3" },
    "verified_at_source_commit": { "$ref": "#/definitions/gitSha" }
  },
  "definitions": {
    "gitSha": { "type": "string", "pattern": "^[0-9a-f]{40}$" }
  }
}
